<!ELEMENT estudiantes (alumno+)>
<!ELEMENT alumno (nif, resultado, observaciones?, (ip | mac))>
<!ELEMENT nif (#PCDATA)>
<!ELEMENT resultado (#PCDATA)>
<!ELEMENT observaciones (#PCDATA)>
<!ELEMENT ip (#PCDATA)>
<!ELEMENT mac (#PCDATA)>
